{
 "schema": "observstory.scene/v1",
 "source": {
  "snapshot_schema": "observstory.snapshot/v1",
  "generated_at": "2026-10-07T15:00:00Z",
  "repository": "northstar/voice-notes",
  "repository_url": null,
  "default_branch": "main",
  "window_hours": 48,
  "title": "Voice notes hackathon (synthetic demo)",
  "lanes_source": "config",
  "degraded": []
 },
 "status": {
  "in_flight": 2,
  "overlaps": 0,
  "waiting": 0,
  "stale": 0,
  "areas_active": 2
 },
 "zones": [
  {
   "id": "intent",
   "label": "Intent",
   "description": "Pitch and decisions",
   "order": 0,
   "state": "quiet",
   "groups": [],
   "in_flight": 0,
   "attention": false,
   "recently_changed": [],
   "recently_changed_more": 0
  },
  {
   "id": "core",
   "label": "Core",
   "description": "Audio, transcription, core API",
   "order": 1,
   "state": "active",
   "groups": [
    "area:src/transcribe",
    "area:src/audio"
   ],
   "in_flight": 2,
   "attention": false,
   "recently_changed": [],
   "recently_changed_more": 0
  },
  {
   "id": "interface",
   "label": "Interface",
   "description": "Recorder UI",
   "order": 2,
   "state": "quiet",
   "groups": [],
   "in_flight": 0,
   "attention": false,
   "recently_changed": [],
   "recently_changed_more": 0
  },
  {
   "id": "verify",
   "label": "Verify",
   "description": "Evaluation",
   "order": 3,
   "state": "quiet",
   "groups": [],
   "in_flight": 0,
   "attention": false,
   "recently_changed": [],
   "recently_changed_more": 0
  }
 ],
 "groups": [
  {
   "id": "area:src/transcribe",
   "zone": "core",
   "path": "src/transcribe",
   "label": "transcribe",
   "parent": "src",
   "attention": false,
   "nodes": [
    "pr:11"
   ],
   "also_active": [],
   "recent_commits": 0,
   "last_activity_at": "2026-10-07T13:00:00Z",
   "age_hours": 2.0
  },
  {
   "id": "area:src/audio",
   "zone": "core",
   "path": "src/audio",
   "label": "audio",
   "parent": "src",
   "attention": false,
   "nodes": [
    "pr:10"
   ],
   "also_active": [],
   "recent_commits": 0,
   "last_activity_at": "2026-10-07T12:30:00Z",
   "age_hours": 2.5
  }
 ],
 "nodes": [
  {
   "id": "pr:10",
   "kind": "pull_request",
   "group": "area:src/audio",
   "zone": "core",
   "ref": "#10",
   "label": "Audio capture pipeline",
   "url": null,
   "status": "in_flight",
   "review_state": "no_reviewer",
   "actors": [
    "alice"
   ],
   "last_activity_at": "2026-10-07T12:30:00Z",
   "age_hours": 2.5,
   "also_touches": [],
   "flags": [],
   "attention": false
  },
  {
   "id": "pr:11",
   "kind": "pull_request",
   "group": "area:src/transcribe",
   "zone": "core",
   "ref": "#11",
   "label": "Local transcription",
   "url": null,
   "status": "in_flight",
   "review_state": "no_reviewer",
   "actors": [
    "ben"
   ],
   "last_activity_at": "2026-10-07T13:00:00Z",
   "age_hours": 2.0,
   "also_touches": [],
   "flags": [],
   "attention": false
  }
 ],
 "edges": [],
 "attention": [],
 "details": {
  "signals": {},
  "work_items": {
   "pr:11": {
    "paths": [
     "src/transcribe/local.py"
    ],
    "paths_total": 1,
    "areas": [
     "src/transcribe"
    ],
    "state": "open",
    "burst": null,
    "merge_base": {
     "sha": "c276345cbb42e82c89cd185e25ff0417f9227d96",
     "source": "compare"
    },
    "commit_count": 4,
    "waiting_on": []
   },
   "pr:10": {
    "paths": [
     "src/audio/buffer.py",
     "src/audio/capture.py"
    ],
    "paths_total": 2,
    "areas": [
     "src/audio"
    ],
    "state": "open",
    "burst": null,
    "merge_base": {
     "sha": "c276345cbb42e82c89cd185e25ff0417f9227d96",
     "source": "compare"
    },
    "commit_count": 4,
    "waiting_on": []
   }
  },
  "areas": {
   "src/transcribe": {
    "files": [
     "src/transcribe/local.py"
    ],
    "actors": [
     "ben"
    ],
    "recent_commits": 0
   },
   "src/audio": {
    "files": [
     "src/audio/buffer.py",
     "src/audio/capture.py"
    ],
    "actors": [
     "alice"
    ],
    "recent_commits": 0
   }
  }
 },
 "coordination": null
}
